{
  "mode": "talking_head_overlay",
  "width": 1920,
  "height": 1080,
  "duration": 60,
  "media": {
    "audio": "assets/talking-head-audio-clean.m4a",
    "video": "assets/talking-head-input.mp4"
  },
  "product_id": "P008",
  "recipe": "TalkingHead_HUD_60s",
  "segments": [
    {
      "start": 0,
      "end": 4.29,
      "text": "为什么你学了很多 AI 工具",
      "caption_line": "为什么你学了很多 AI 工具",
      "visual_module": "HookScene",
      "component": "HookScene",
      "component_props": {
        "kicker": "问题命中",
        "headline": "为什么你学了很多 AI 工具",
        "subline": "先看问题，再看工具"
      },
      "layout_slot": "right",
      "safe_zone": "opposite_of_face",
      "animation": "scale_blur_in",
      "emphasis_keyword": " AI 工具",
      "density": "high",
      "semantic_role": "pain_hook",
      "proof_point": "给出一个可执行判断",
      "cta_type": "none"
    },
    {
      "start": 4.29,
      "end": 8.58,
      "text": "还是没有真正提高效率",
      "caption_line": "还是没有真正提高效率",
      "visual_module": "HookScene",
      "component": "HookScene",
      "component_props": {
        "kicker": "问题命中",
        "headline": "还是没有真正提高效率",
        "subline": "先看问题，再看工具"
      },
      "layout_slot": "right",
      "safe_zone": "opposite_of_face",
      "animation": "scale_blur_in",
      "emphasis_keyword": "真正提高效率",
      "density": "high",
      "semantic_role": "pain_hook",
      "proof_point": "给出一个可执行判断",
      "cta_type": "none"
    },
    {
      "start": 8.58,
      "end": 12.87,
      "text": "不是工具不够多",
      "caption_line": "不是工具不够多",
      "visual_module": "HookScene",
      "component": "HookScene",
      "component_props": {
        "kicker": "问题命中",
        "headline": "不是工具不够多",
        "subline": "先看问题，再看工具"
      },
      "layout_slot": "right",
      "safe_zone": "opposite_of_face",
      "animation": "scale_blur_in",
      "emphasis_keyword": "是工具不够多",
      "density": "high",
      "semantic_role": "pain_hook",
      "proof_point": "给出一个可执行判断",
      "cta_type": "none"
    },
    {
      "start": 12.87,
      "end": 17.16,
      "text": "是流程没有跑起来",
      "caption_line": "是流程没有跑起来",
      "visual_module": "AgentDashboard",
      "component": "AgentDashboard",
      "component_props": {
        "nodes": [
          "Hermes",
          "Obsidian",
          "llm-wiki",
          "Codex",
          "HyperFrames"
        ],
        "status": "running"
      },
      "layout_slot": "wide",
      "safe_zone": "opposite_of_face",
      "animation": "node_cascade",
      "emphasis_keyword": "程没有跑起来",
      "density": "medium",
      "semantic_role": "workflow",
      "proof_point": "给出一个可执行判断",
      "cta_type": "none"
    },
    {
      "start": 17.16,
      "end": 21.45,
      "text": "我会把真人口播放在中间",
      "caption_line": "我会把真人口播放在中间",
      "visual_module": "KPIWidget",
      "component": "KPIWidget",
      "component_props": {
        "value": "3步",
        "label": "把抽象努力变成可检查结果",
        "unit": ""
      },
      "layout_slot": "left",
      "safe_zone": "opposite_of_face",
      "animation": "count_up",
      "emphasis_keyword": "口播放在中间",
      "density": "medium",
      "semantic_role": "kpi",
      "proof_point": "给出一个可执行判断",
      "cta_type": "none"
    },
    {
      "start": 21.45,
      "end": 25.74,
      "text": "HUD 只放在人物反侧",
      "caption_line": "HUD 只放在人物反侧",
      "visual_module": "TopicCard",
      "component": "TopicCard",
      "component_props": {
        "title": "正确做法",
        "body": "HUD 只放在人物反侧"
      },
      "layout_slot": "right",
      "safe_zone": "opposite_of_face",
      "animation": "panel_expand",
      "emphasis_keyword": "放在人物反侧",
      "density": "medium",
      "semantic_role": "explain",
      "proof_point": "给出一个可执行判断",
      "cta_type": "none"
    },
    {
      "start": 25.74,
      "end": 30.03,
      "text": "字幕只保留中文",
      "caption_line": "字幕只保留中文",
      "visual_module": "TopicCard",
      "component": "TopicCard",
      "component_props": {
        "title": "正确做法",
        "body": "字幕只保留中文"
      },
      "layout_slot": "right",
      "safe_zone": "opposite_of_face",
      "animation": "panel_expand",
      "emphasis_keyword": "幕只保留中文",
      "density": "medium",
      "semantic_role": "explain",
      "proof_point": "给出一个可执行判断",
      "cta_type": "none"
    },
    {
      "start": 30.03,
      "end": 34.32,
      "text": "底部 180px 不放主信息",
      "caption_line": "底部 180px 不放主信息",
      "visual_module": "TopicCard",
      "component": "TopicCard",
      "component_props": {
        "title": "正确做法",
        "body": "底部 180px 不放主信息"
      },
      "layout_slot": "right",
      "safe_zone": "opposite_of_face",
      "animation": "panel_expand",
      "emphasis_keyword": " 不放主信息",
      "density": "medium",
      "semantic_role": "explain",
      "proof_point": "给出一个可执行判断",
      "cta_type": "none"
    },
    {
      "start": 34.32,
      "end": 38.61,
      "text": "当我讲Hermes、Obsidian、",
      "caption_line": "当我讲 Hermes Obsidian",
      "visual_module": "AgentDashboard",
      "component": "AgentDashboard",
      "component_props": {
        "nodes": [
          "Hermes",
          "Obsidian",
          "llm-wiki",
          "Codex",
          "HyperFrames"
        ],
        "status": "running"
      },
      "layout_slot": "wide",
      "safe_zone": "opposite_of_face",
      "animation": "node_cascade",
      "emphasis_keyword": "sidian",
      "density": "medium",
      "semantic_role": "workflow",
      "proof_point": "给出一个可执行判断",
      "cta_type": "none"
    },
    {
      "start": 38.61,
      "end": 42.9,
      "text": "llm-wiki、Codex、",
      "caption_line": "llm-wiki Codex",
      "visual_module": "AgentDashboard",
      "component": "AgentDashboard",
      "component_props": {
        "nodes": [
          "Hermes",
          "Obsidian",
          "llm-wiki",
          "Codex",
          "HyperFrames"
        ],
        "status": "running"
      },
      "layout_slot": "wide",
      "safe_zone": "opposite_of_face",
      "animation": "node_cascade",
      "emphasis_keyword": " Codex",
      "density": "medium",
      "semantic_role": "workflow",
      "proof_point": "给出一个可执行判断",
      "cta_type": "none"
    },
    {
      "start": 42.9,
      "end": 47.19,
      "text": "HyperFrames时",
      "caption_line": "HyperFrames 时",
      "visual_module": "AgentDashboard",
      "component": "AgentDashboard",
      "component_props": {
        "nodes": [
          "Hermes",
          "Obsidian",
          "llm-wiki",
          "Codex",
          "HyperFrames"
        ],
        "status": "running"
      },
      "layout_slot": "wide",
      "safe_zone": "opposite_of_face",
      "animation": "node_cascade",
      "emphasis_keyword": "ames 时",
      "density": "medium",
      "semantic_role": "workflow",
      "proof_point": "给出一个可执行判断",
      "cta_type": "none"
    },
    {
      "start": 47.19,
      "end": 51.48,
      "text": "侧边显示工具流",
      "caption_line": "侧边显示工具流",
      "visual_module": "TopicCard",
      "component": "TopicCard",
      "component_props": {
        "title": "正确做法",
        "body": "侧边显示工具流"
      },
      "layout_slot": "right",
      "safe_zone": "opposite_of_face",
      "animation": "panel_expand",
      "emphasis_keyword": "边显示工具流",
      "density": "medium",
      "semantic_role": "explain",
      "proof_point": "给出一个可执行判断",
      "cta_type": "none"
    },
    {
      "start": 51.48,
      "end": 55.77,
      "text": "最后回复视频模板",
      "caption_line": "最后回复视频模板",
      "visual_module": "TopicCard",
      "component": "TopicCard",
      "component_props": {
        "title": "下一步",
        "body": "最后回复视频模板"
      },
      "layout_slot": "right",
      "safe_zone": "opposite_of_face",
      "animation": "pulse_in",
      "emphasis_keyword": "回复视频模板",
      "density": "high",
      "semantic_role": "cta",
      "proof_point": "评论关键词领取清单",
      "cta_type": "comment_keyword"
    },
    {
      "start": 55.77,
      "end": 60,
      "text": "领取分镜检查清单",
      "caption_line": "领取分镜检查清单",
      "visual_module": "TopicCard",
      "component": "TopicCard",
      "component_props": {
        "title": "下一步",
        "body": "领取分镜检查清单"
      },
      "layout_slot": "right",
      "safe_zone": "opposite_of_face",
      "animation": "pulse_in",
      "emphasis_keyword": "分镜检查清单",
      "density": "high",
      "semantic_role": "cta",
      "proof_point": "评论关键词领取清单",
      "cta_type": "comment_keyword"
    }
  ]
}
